{
  "name": "subject-blob-only-preserved",
  "description": "A subject made only of a blob remains its own base subject instead of being collapsed to empty.",
  "spec": {
    "source": "RFC 5256",
    "url": "https://www.rfc-editor.org/rfc/rfc5256",
    "behavior": "the last subj-blob is treated as subj-base when subj-base would otherwise be empty"
  },
  "input": [
    {
      "id": "tag-only",
      "message_id": "<tag-only@example>",
      "in_reply_to": null,
      "references": [],
      "subject": "[mxr]",
      "date": "2026-05-15T09:00:00Z"
    },
    {
      "id": "tag-reply",
      "message_id": "<tag-reply@example>",
      "in_reply_to": null,
      "references": [],
      "subject": "Re: [mxr]",
      "date": "2026-05-15T09:05:00Z"
    },
    {
      "id": "plain-mxr",
      "message_id": "<plain-mxr@example>",
      "in_reply_to": null,
      "references": [],
      "subject": "mxr",
      "date": "2026-05-15T09:10:00Z"
    }
  ],
  "expected": {
    "threads": [
      {
        "root": "tag-only",
        "messages": [
          "tag-only",
          "tag-reply"
        ]
      },
      {
        "root": "plain-mxr",
        "messages": [
          "plain-mxr"
        ]
      }
    ]
  }
}
